{
  "contract_version": "ts-execution-request/v0.2",
  "request_id": "req-canonical-sha256-0001",
  "Product_ref": "synthetic/product-alpha",
  "Product_operation_ref": "op://synthetic/product-alpha/digest-payload",
  "ExecutionAttempt_ref": "attempt://synthetic/product-alpha/digest-payload/1",
  "execution_profile_ref": "profile://ts-execution-lab/canonical-sha256/v0",
  "subject_ref": "sha://synthetic/product-alpha@main",
  "context_id": "ctx-alpha-0001",
  "input": { "payload_json": { "hello": "world", "n": 1 } }
}
